email_subject,email_open_user_count,sent_user_count,open_rate
Gone In A Flash! Shop Flat Store!,35388,650412,5.44
Let sharing be one of the reasons to be happy! Start Sharing!,404,7428,5.44
Get Stylish. Get Lucky,821,15089,5.44
Shirts Every Girl Loves On Guys!,32812,603025,5.44
12 HOURS ONLY! Your Fav Kurtas,40736,749463,5.44
Shorts To Shop Under 799!,2367,43545,5.44
Valentine's Day is over but our love for your style is not! Keep Creating!,286,5253,5.44
Big Deals on Denims. Grab yours under 899,38380,706498,5.43
Casual shirts at min. 40% of!,35256,648916,5.43
Everything At Flat 500!,29172,537716,5.43
We just met you & we're in love with you already!,520,9574,5.43
Chanderi Suits To Play Hide And Chic,106007,1953517,5.43
Stay indoors in style like Kangana Ranaut,23547,434436,5.42
50+ T-Shirts Under 899!,2326,42926,5.42
Buy 2 T-Shirts Under 599!,101553,1876644,5.41
Happy Sunday {user_first_name} !,40046,740339,5.41
Wardrobe Essentials!,16230,300100,5.41
200+ Maxi Dresses! Super HOT🌺,1357,25102,5.41
Work gets a makeover!🎓Shop workwear,3532,65444,5.4
Deal Alert: Bestselling Kurtas For You,48570,899136,5.4
Sandals & Floaters under 599!,2444,45220,5.4
Let's unlock the surprise...,15643,289933,5.4
Sarees to wear when it's HOT!,16222,301094,5.39
Upto 60% Off On handpicked Kurtas,25783,478000,5.39
We're thinking red & yellow this festive season. Are you?,398,7383,5.39
GOOD NEWS for all the Stylists,292,5420,5.39
Final Hours! 100% CashBack ending in 6 Hours,173639,3218519,5.39
We Will Assure Min. 50% Off!,34624,642606,5.39
"Hi {user_first_name}, Trends that never go out of fashion!",17906,332730,5.38
It's a free SMARTPHONE,274,5095,5.38
Hello Weekend! New Bell Sleeve Tops Just Arrived!,10928,203082,5.38
Exactly what your closet is missing!,1668,31027,5.38
You have what it takes to be a Style Expert,137,2553,5.37
Celebs are crushing on 'net' & so are we!,20738,386264,5.37
Your Fashion Guide Here! Let's Gooo,20085,374674,5.36
200+ Most loved kurtas!,48872,910979,5.36
Varun Dhawan added a fun element to his formal look,30877,575977,5.36
It's a TREAT!,45971,857765,5.36
Check In For Summer Under 599!,39729,741574,5.36
Looking for classy & comfy kurtas?,25308,473254,5.35
"{user_first_name}, FREE delivery of items in your LimeRoad cart",24251,453574,5.35
{user_first_name} Weekend is Coming!,10599,198280,5.35
Nothing is better than a SHARING heart❤,546,10218,5.34
It's a Woo Wednesday!!!,600,11230,5.34
Time For NEW Lingerie!,30015,561815,5.34
Look dapper like Saif Ali Khan,25775,483506,5.33
Buy 2 at 699! top to bottom,13680,256730,5.33
"Hey, you just saved Rs.{disocunt_total}!",3994,75022,5.32
Chic kurtas starting 1499,8216,154442,5.32
Your Summer Guide!,35838,674259,5.32
400+ Best T-Shirt On Sale!,38309,720273,5.32
Meet the new Fanney's of Bollywood!,3118,58705,5.31
Handpicked Tees for summer.,2709,50975,5.31
Mid Of Month And Broke!,35372,666425,5.31
Let The Party Begin! 9:30 AM To 9:30 PM!,48480,915048,5.3
Mandarin collar shirts under 899. Buy Now,36224,683917,5.3
Why did you uninstall our App?,299644,5667119,5.29
Style Indian TV's betas & Bahus and win Big!,2851,53844,5.29
Here's what to do if SHAR-ing is a FUN thing for you!,247,4665,5.29
Upto 70% Off / Limited Period Offer,38632,732014,5.28
Pretty in florals now starting at 350/-🌸,14388,272648,5.28
Solid tees we all need in our closet.,6174,117011,5.28
Aamir Khan proves basics are not boring,25521,483028,5.28
Are you a true movie buff?,298,5649,5.28
TOO GOOD TO MISS,271,5134,5.28
She looks no less than a dream & is nailing the ethnic trends like none other!,121,2294,5.27
Must haves in every shoe collection.,37696,715104,5.27
"We heart It, You Cart It! Love For Khadi 🦋",37419,709730,5.27
"{user_first_name}, Cool & Comfy Rayon Kurtas",1916,36359,5.27
Top Discounts! Flat 450! 👔,36500,692659,5.27
10 Sarees you gotta Flaunt this month!,39944,759975,5.26
Chase The Trend! Flared Kurtas 💃🏻,33234,631323,5.26
Few Hrs Left!!,307,5833,5.26
And the COUNTDOWN BEGINS!!!,264,5032,5.25
Gifts For Your Ultimate Style Icon,33597,640209,5.25
SOME THINGS NEVER COME BACK!!,930,17700,5.25
All New + Footwear + Under 599!,1872,35646,5.25
"Tell your friends, you could be the next Style expert",128,2444,5.24
Live for only 12 Hours! Sneak Peak💫,14270,272333,5.24
Shahid Kapoor in ALL-WHITE,24376,466175,5.23
Get Min. 60% Off On Wardrobe Faves 👌,15989,305601,5.23
"{user_first_name}, FREE delivery of items in your cart.",144259,2765194,5.22
Lightning Deals on our best styles!,28426,544807,5.22
Pathani Kurta sets you can't miss out on,26112,500056,5.22
"{user_first_name}, SUNDAY SURPRISE! FREE delivery of items in your cart.",46208,885028,5.22
Just Arrived ❤️ | Be The First Onw To Get,6351,121716,5.22
Your🌈DREAM☁️Offers On Olive Colour Trend!,35051,671981,5.22
"Be Bold, Be Beautiful, Be You",300,5760,5.21
IT'S OFFICIAL! We'll be taking you to the next level!,3217,61724,5.21
Printed & striped tees for a wardrobe upgrade | Free Shipping,2959,56763,5.21
FREE! FREE! GIFT for Shopping!,2863,54927,5.21
Kurtas for College Girls!,23573,453614,5.2
The Summer Clearance Sale Is Here!,32617,626750,5.2
Fusion Picks This Season By Fashion Editor's,36762,708652,5.19
Under 500! Most Loved Trends Of the Season,18436,355030,5.19
8AM TO 8PM DEAL!,34594,666434,5.19
Sharing doesn't cost anything & sharing is good!,246,4743,5.19
Can't decide what to wear at work?,9215,177787,5.18
Get Kareena Kapoor's easy to-do look,21955,423998,5.18
It's A Saving Day!,37258,719327,5.18
6 Colours Of The Season To Own!🦋,15470,298374,5.18
Get Classic With Solid Kurta,52066,1005201,5.18
"{user_first_name}, Stay safe, stay home & shop online",114,2200,5.18
Get Malaika Arora's patola saree look!,8938,172532,5.18
Green Is The Colour Today! 💚,39280,758307,5.18
90% Of Women Love These Shirts On Guys!,30224,583700,5.18
Treat Yo'self & Dress The Day💃🏼,14475,279946,5.17
Wish It & Win It,334,6466,5.17
"{user_first_name}, You've just unlocked our Gold Membership!",5758,111372,5.17
Lockdown is not boring! Shop with us.,2115,40878,5.17
We wish all the very best to the villian of Bahubali: Bhalladeva!,2716,52671,5.16
🕗Last 3 Hrs: free delivery of items in your cart! hurry,32623,631633,5.16
Don't be a stranger,129,2500,5.16
Your Answer To Summer Dressing,38176,740428,5.16
The Timer’s Going Off On Your cart!,46616,902691,5.16
Soak Up The Sun & Savings🌞😎 ! Brand Deals!,29936,581323,5.15
Time for some trousers!,19377,376556,5.15
For all your summer plans🌞😎,32862,637584,5.15
Get watches under 599,34734,673854,5.15
We can't get enough of denim. Can you?,18171,353661,5.14
Polo Tees are never going out of style,22777,443050,5.14
Are you flaunting blue this season?,6130,119293,5.14
Min. 50% off on everything,33999,662899,5.13
Really💥😱 Denims Under 799!,35416,690070,5.13
Exclusive Kurtas At Flat 70% Off!,1808,35212,5.13
SUPER SAVER for Wed Wonders!,30802,601705,5.12
Pastels are trending!,23321,455112,5.12
Get.Set.Shop!|Kurtas at upto 80% off,19240,375534,5.12
You Just Can't Resist! Spring🌼New Arrivals,34854,680830,5.12
"Hi {user_first_name}, Top seller kurtas | Starting at just 500🏃🏻‍♀️",31256,611375,5.11
NEW Dresses To Pick From!,22933,449009,5.11
The very best-kurtas you can wear everyday!,39535,773707,5.11
Freedom Of Style! Get Everything FLAT 350!,44729,874497,5.11
Lockdown is not boring! Shop with us {user_first_name},2448,47932,5.11
Kurta Rush Hour: Only For 24 Hours,49425,968262,5.1
Style the b-town sisters & WIN stylish handbags!!!!!!!,360,7053,5.1
One Month Free Trial! Get Gold Membership,5181,101650,5.1
The Summer Look Book for your favourite ethnics!,14976,293895,5.1
Shop new & trending styles,85390,1676270,5.09
Letter from the heart! Just for you ❤,1031,20239,5.09
Trends with benefit! Kurtas Upto 80% off,54044,1062626,5.09
"""FINAL NOTICE"" Upto 70% Off!",36295,713021,5.09
"{user_first_name}, Grab your wardrobe essentials ASAP! ⏱️",16956,333149,5.09
Starting 300! Best Picked Catalogue😉,30896,608719,5.08
Your Dream Exclusive Wardrobe Under 799!,35051,690443,5.08
Upto 70% Off On Exclusives,33737,665191,5.07
Jaipur❤️Love All Over This June!,41456,818192,5.07
Those Glittery Nights With Ur Special One,36679,723808,5.07
Decode Bobby Deol's latest look,26965,531763,5.07
Don't SHARE your fries!!!,227,4481,5.07
Upto 80% Off | Asymmetrical Kurtas 💯,33523,663038,5.06
Janhvi Kapoor's style is steal-worthy!,10213,201664,5.06
New Arrivals Finishing Up Fast!,41620,823656,5.05
All Things Summer!🌸Ethnic Sets You'll Love,32230,637590,5.05
Upto 80% Off | Solid Kurtas 🌼,54939,1087277,5.05
Perfect gifts for your bae!,15274,302543,5.05
Every day workwear shirts.,18421,365757,5.04
Top Notch Styles | Upto 75% Off💃🏾,12881,255790,5.04
Start Your Monday By Shopping Under 499!,29188,578772,5.04
Hot Styles starting 199! Shop Exclusives,13060,259036,5.04
1+1 Is Back! Watch Combos Under 699!,2423,48090,5.04
Show us gifts to give your best friend & win them too!,2607,51681,5.04
Don't Forget To Pack These Essentials!,38547,765842,5.03
Shop Now : Tees To Shop Under 499!,4345,86361,5.03
Big Sale Begins Today!,30960,616006,5.03
Festive Sets: Min. 40% Off! Deal Of The Day⚡️,35263,701259,5.03
Back with a BANG!!,322,6404,5.03
Sagittarius Season! The December Special,15587,309810,5.03
Going for a vacay?,27200,541339,5.02
THE BIG BIG SURPRISE! OPEN💌,45534,907041,5.02
We loved your last shared look. Mind sharing some more?,386,7691,5.02
Dreaming of a Red & White Christmas🎅,301,5998,5.02
Army Print T-Shirts Under 599!,32242,642283,5.02
3️⃣🔜2️⃣🔜1️⃣ Countdown To MAGICAL Hours!,34201,682300,5.01
Looking for summer blazers?,24091,480614,5.01
Our big freedom sale !,44096,882373,5
It's Summer! You know what that means.,6172,123352,5
10 DAYS LEFT,265,5305,5
Edit your wardrobe with these T-Shirts,38251,764324,5
Do what you love❤,586,11729,5
3 FOR 999 | BIG DEAL BANG SALE,111934,2239832,5
Look ravishing in red this season!,6179,123874,4.99
December Hotsellers: Be in the spotlight,47273,947594,4.99
Because great style is meant to be shared!,518,10372,4.99
You can't survive without these perfect Kurtas!,56948,1141870,4.99
6 Type of tees every guy should have!,31130,623507,4.99
ALERT: Fresh Off The Runway!💃🏻New Kurtas!,33509,671078,4.99
ALERT! You've got 1000 credits.,1356,27162,4.99
It's the winter sale!,61445,1230729,4.99
Duffle Bag at only Re.1!,6700,134541,4.98
Cool colors for a cool you! 💙,17231,346245,4.98
Lovin' them Dreses! Shop Collection,3197,64288,4.97
Top Seller Brands On Sale,3854,77561,4.97
Madhuri Dixit and Vidya Balan spotted in RED,23445,471565,4.97
Creativity takes Courage,648,13064,4.96
Chill at home like Twinkle Khanna,22595,455484,4.96
Jockey Or Nothing,44221,890736,4.96
6 Types Of Tees To Own In Your Wardrobe!,40149,809201,4.96
Treat Yo'Self Upto 75% Off,12811,258271,4.96
Style the drama & controversy queen: Rakhi Sawant,374,7535,4.96
200+Kurtas| Upto 80% Off 💰,32615,659275,4.95
BUY1 & GET2 ! Is Now Live!,32801,662952,4.95
Did you use your credits?,30744,621644,4.95
Our Most Loved Brand is Now At Sale!🤡,34353,695550,4.94
Everything That Is New!,16804,339891,4.94
Tap your feet on the beat in style.,41324,836797,4.94
HO! HO! HOME SWEET HOME🎅,309,6257,4.94
Hi Stylist! You help us dress better everyday,176,3566,4.94
Shop now our trendy kurta brands Nayo & Vishudh,2579,52244,4.94
WOOHOO! GOOD NEWS for the BUDDING STYLISTS!!!!,1075,21751,4.94
Love telling your friends you're a Star Stylist? Keep Creating!,112,2272,4.93
Our Biker Jeans are all these and more!,15017,304854,4.93
Deal Of The Day! Shop Now!,33636,681875,4.93
Re.1 Sale is live!,243848,4948112,4.93
20decmailerallnew,261,5302,4.92
MOST WANTED: Skirt Sets To Rock The Indie Look!,32705,664109,4.92
The best way to stay happy is to SHARE!,423,8602,4.92
Things no one ever told you before!,3334,67821,4.92
Forgot something in your LimeRoad cart?,34719,706469,4.91
Black Friday! Endless Buy,13257,269864,4.91
All Your Favorite Things At Never Before Prices!,30503,621857,4.91
Wardrobe the highlife! Shop Now,35279,718957,4.91
Stay trendy all winter!,5889,119944,4.91
Effortless styles to get you puja ready!,36954,752342,4.91
"Hello {user_first_name}, Product is on Sale! Ending Today.",31939,652482,4.9
Look Effortlessly Chic In This Classic Combination Of Black On Black,18215,371964,4.9
Tendulkar's sartorial stroke,733,14962,4.9
Hot News: Upto 21% off on all orders!,30526,623326,4.9
1000+ Colourblock Tees | Under 599,43720,892251,4.9
Cocktail night sarees to dazzle in!,14547,297649,4.89
LimeRoad Hunt Begins! Be are our next stylist!,3087,63123,4.89
Skult By Shahid Kapoor At 40% Off!,30038,613933,4.89
"Hi {user_first_name}, Grab a pair of sneakers",3754,76991,4.88
Under 499! You Wished For It!,35287,722477,4.88
Flat 52% Off| Kurtas On Gerua,27962,573071,4.88
12 Hours Deasl! Get Upto 80% Off!,31047,636441,4.88
April's Bestselling Tops You Must See,1600,32843,4.87
You never know who you are inspiring,295,6054,4.87
6 Must Own Shirts For Every Guy!,33034,677968,4.87
Buy Sports Shoes under 699,37748,774562,4.87
Kareena pulls off this look so gracefully!,8395,172403,4.87
Steal Rannvijay's sporty look,21687,444932,4.87
10 Kurta Picks by our Fashion Bloggers!,48090,990072,4.86
S.O.S | Upto 80% Off On Footwears,35549,731263,4.86
Sexy Party Wear At Min. 60% Off!💃🏼,12218,251400,4.86
Are you leaving us? But why?,4013,82626,4.86
"CREATIVITY! The more you use, the more you have!!",278,5736,4.85
💸Here's Rs.100 for You! Buy all your favourite!,73856,1523051,4.85
Shop Watches Under 499!,35949,740645,4.85
Re. 1 Sale is Live!,77007,1588102,4.85
IT'S RAINING CREDITS💦💦,2495,51410,4.85
6 Types Of Dresses For Every Girl!💃🏾,13356,275150,4.85
Handpicked festive styles for you!,33805,697129,4.85
Shop Now Or Never!,74059,1527631,4.85
Done being just a Star Stylist?,98,2021,4.85
Kangana Ranaut's Summer Look Is Right Here,33027,680855,4.85
"Think less, SHARE more!",4547,93858,4.84
"Festive season is here, Shop short kurtas's upto 80% Off!",100041,2065653,4.84
☮️Blame My Gypsy Soul! Big Pockets,28804,595337,4.84
90's CheckBoard Print Is Coming Back!,41856,865496,4.84
Mughal Florals are CELEB approved!,21712,448354,4.84
STYLE hard so you can SHOP harder,310,6413,4.83
Back with a bang! Buy 1 Get 1 For 1 | Coming soon,62543,1293755,4.83
Sports Shoes Under 699! Shop Now!,34552,716008,4.83
Dresses Starting 1299! Just Add To Cart!,1736,36051,4.82
Now! Explore Sandal & Floaters Under 499!,32457,672732,4.82
Raining Discounts at EOSS!,9126,189347,4.82
Sunset hues in reds and oranges!,71788,1493542,4.81
100+ Kurtas Under 999 ❤️❤️,29451,612713,4.81
We Just Added Our Gorgeous Pieces! Buy Now,13478,280815,4.8
"Discover today, new styles for Durga Puja",28014,583874,4.8
Best selling denims at best prices!,41349,860554,4.8
Editor's Picks! Bloom In Whites Girl,35120,733132,4.79
A big surprise 😱& a lot of excitement waiting for you! Get Ready!,2533,52877,4.79
New Crush Alert: New Ethnic Dresses 🦋,31733,662646,4.79
Printed Shirts Under 699 + Free Shipping!,2284,47694,4.79
Grab Them All!,1668,34814,4.79
How lucky can you get today?,35148,734265,4.79
200+Kurtas upto 60% off,28282,592229,4.78
Hey Stylist! Are you ready for summer?,3031,63453,4.78
Wake up & Inspire!,2312,48365,4.78
It''s only through SHARING that Friendships are born,245,5138,4.77
Know Our Bestsellers! Min. 60% Off,10803,226477,4.77
Do the 'Olive on Olive' like Asim Riaz!,20929,439797,4.76
"Hi{user_first_name}, Here is a sweet surprise for you. Open to find out!",97601,2049168,4.76
Shop this season's hottest prints!,32852,690226,4.76
Menswear must-haves for all seasons!,122936,2586487,4.75
Here's how to make the most of your lockdown,11904,250524,4.75
Under 599 straight kurtas! grab now🎉,30626,644757,4.75
New Year Bling! Shop Collection,13934,294011,4.74
"Tic-toc-tic, don't let this slip. You've got 2000 credits!",35212,743565,4.74
Sale Take Away! Upto 90% Off,12159,256431,4.74
We want to see your most filmy style,331,6982,4.74
Love From Banaras! Sarees You'll Love ❤️,31719,669907,4.73
Save Big with 1000 credits!,7564,159911,4.73
Sidharth Malhotra's look is crush-worthy,5161,109083,4.73
"Hi {user_first_name}, shop Casual shoes under 999!",3651,77257,4.73
KURTAS FLAT 700| Place Your Order Now,2978,62966,4.73
What your zodiac says for January 2019 💕,17950,379789,4.73
🔝+Trends+❤️= Solve The Riddle,30430,642979,4.73
Our Bestselling💜Products At Your Doorstep!,34879,738045,4.73
Cold-weather layers starting 799,3333,70548,4.72
"{user_first_name}, Chevron printed tees & white denims 👕",21361,452339,4.72
T-Shirts Every Girl Loves On guys!,29754,630797,4.72
Dip Your Feet In Glitter!😍Bling It On,39001,825580,4.72
Rang Barse : The Holi Sale Is On!,31028,657431,4.72
Sharing the love is always a good idea!,29724,629838,4.72
Here's why you should start watching TV,784,16626,4.72
What day is it today?,280,5926,4.72
Our STYLIST Picked Her Fav Flared Kurtas!,32028,677926,4.72
Our Top 300 Picks For Summer! Shop Now!,38349,813456,4.71
Into The Blue,32853,697242,4.71
Sonam Kapoor's Gota Work look,46466,986871,4.71
Trouser to fit any occasions. have a look,33167,705579,4.7
The new kurtas everyone's eyeing! 😍,14106,300335,4.7
Most Loved😎Brands at Min. 60% Off,31844,678031,4.7
This summer have fun with prints!,10582,225111,4.7
Summer🌼Outfits To SLAY IN! Summer Tops,27725,589734,4.7
#BudgetBuy: flat 70% off store,6109,129908,4.7
ALine Kurtas Under 699,26081,555786,4.69
Emerald: The trendiest colour right now!,13860,295620,4.69
Urgent: Your account needs important action!,12956,276163,4.69
Here's a curated festive range,37665,803251,4.69
Work with us without leaving home!,14684,312823,4.69
You missed something important!,4112,87643,4.69
FREE delivery of items in your LimeRoad cart! Don't Miss!!,31248,667525,4.68
Re.1 Sale is back with a bang!,91172,1947853,4.68
New Year Call! The Red & Black,13684,292513,4.68
Janhvi Kapoor knows how to look her best.,8546,182477,4.68
Got a date tonight?,17353,371841,4.67
It's time to Get Fit!,17088,365770,4.67
The Saree Closet for the fall,58846,1259568,4.67
Done being just a Budding Stylist?,2240,47935,4.67
Done with blue & black ✓,11333,243166,4.66
Tops Under 399! Just For TODAY💛,10724,230249,4.66
The Flat 800 Store Is Back! Shop Now!,2015,43216,4.66
Only For Today! 100+ Tees Under 499!,27049,580428,4.66
Meet Harsha! She won a meal at the Taj Falaknuma Palace & it was on us!,3356,72063,4.66
Shop Every Footwear Under One Roof!,41023,879628,4.66
Thank God It's Friday!{user_first_name},34726,744863,4.66
💥BELOW 329!💥Don't Ever Miss This!,22181,477030,4.65
KALANK's Look Can Be Yours! Pick Yours,32223,693114,4.65
Shop Our Top Brands 🌸 Limited Time Only,37193,799628,4.65
"{user_first_name}, find out the perfect colours of the season! 🌈",14746,316868,4.65
Embroidered Sarees Only For You,30316,651716,4.65
Breaking | Extra 100 Off On 899,57957,1247529,4.65
"{user_first_name}, Discover All the shades of Khaki!",83781,1803565,4.65
Which Ma on silverscreen do you love the most?,22074,474204,4.65
Going to work doesn't have to be boring!,5680,122376,4.64
Re.1 Sale ending in 6 Hours!,50309,1084312,4.64
On-trend winter wear to keep you cosy,49731,1072369,4.64
6 Types Of Tops A Girl Must Own! 💛,13692,294832,4.64
Kiara Advani's go-to tops look so cool!,5784,124669,4.64
Playing Dress Up🌸💃🏼,13647,294352,4.64
Cue: How to brighten a winter day.,5976,128924,4.64
Trend At Ease! Shop The Summer Solid Kurtas,26121,562740,4.64
15 days GONE. 15 days LEFT,318,6873,4.63
TODAY: Your Cart Picks now Upto 50% Off!,35895,774536,4.63
Spring Has Sprung! Grab The Collection Now,34724,749293,4.63
Click Open For Surprise,31764,686772,4.63
Hot News: Upto 21% off on all orders!,5143,111384,4.62
FASH' FOR LESS! Kurtas Under 499,29666,643994,4.61
Shop Now From Our Monsoon Edit!,70338,1524833,4.61
The prices have just dropped!,38706,838700,4.61
Dress The Day Upto 50% Off ! Buy Now 😻,29751,646370,4.6
Gold membership for FREE!,3416,74232,4.6
Hey Stylist! We've been missing your amazing style! Show Us More!,2999,65254,4.6
Feminine floral prints! Summer Calls🌼,12931,280955,4.6
"Hey{user_first_name}, What your zodiac says for February 2018 💕!",220608,4796125,4.6
Drape yourselves in unique kalamkari!,14794,321629,4.6
We Have The Perfect Set Of Warmers,18512,403610,4.59
Chase the Cold Away!,18686,406924,4.59
Jackets You must own.,31605,689250,4.59
Kurtas you can wear like Maxi Dresses!,82864,1806268,4.59
Flared Sleeve Kurtas Down To 565! 🌈,33836,739433,4.58
Under 599! Don't Wait Anymore🤡,11803,257975,4.58
An Ode To Indian Heritage! Shop Handloom Kurta!,44654,976333,4.57
Coz Something Huge Is On Its Way 💫,29128,636972,4.57
Your Girlfriend Loved These! ❤️,34851,763409,4.57
10 DAYS GONE,588,12878,4.57
Shrugs starting at 350! Shop now,46173,1009528,4.57
Summer Footwear Under 499!,32758,717430,4.57
Keep It Short!,15966,350238,4.56
Found: The Best Of Handpicked Kurtas,36778,806955,4.56
Winner! You've got Rs.250 Off.,4986,109346,4.56
Bid farewell to dry and dull hair.,16432,360241,4.56
Just Arrived only for you,11480,251568,4.56
Vidya Balan's saree is steal-worthy,21716,477622,4.55
Upto 30% Off! Unlock your discount.,79534,1747653,4.55
Kriti Sanon wants us to take out florals!,6187,135987,4.55
Final Call! Rs.250 Off.,96865,2126635,4.55
All your durga puja celebrations covered! 🌟,72486,1591818,4.55
Thursday Treats! Min. 40% Off on your cart,11985,264129,4.54
Last day to order!,1967,43353,4.54
T-Shirt At Flat 500 Only!,2179,48027,4.54
It's now or never!,277,6121,4.53
Mixed Curated Casual Trousers,17930,395500,4.53
Do you know what you're missing out on?,2896,63971,4.53
How far can you go to style your favorite Star?,491,10837,4.53
1+1 DEALS = Combos Under 699!,2418,53547,4.52
Footwear At Flat 499 Only!,37719,834984,4.52
A day out with denims!,16899,374206,4.52
Winter Curation From ' Tees Collection',15830,350092,4.52
A Classic White T-Shirt Edit!,17030,376810,4.52
Best deals of this season!,16010,353915,4.52
Get Everything At Flat Prices!,36062,799222,4.51
Holi Party To Attend? Get Your Look!,32352,716847,4.51
The Ultimate Power Accessory! Shop Bags!,31494,697827,4.51
Be mehendi ready in bright kurta sets!,25397,562855,4.51
Digital Printed Kurtas Starting 349,34275,762328,4.5
Polo T-shirts Under 599 Are Up For Grabs,34861,774855,4.5
One Month Free Trial! Get Gold Membership.,398,8849,4.5
Breaking!! 100% Cashback Sale Live Now!,110113,2446763,4.5
This tv couple is all set to get married,326,7240,4.5
Sailancor! Shop the best styles.,34897,774726,4.5
Rock a nehru jacket like Kunal Khemu!,15888,352799,4.5
Shop 50+ On Trend Styles,54602,1214294,4.5
New trends are here! Shop today,14204,316193,4.49
Ending Soon! Grab All your Favourite Brands,34779,773871,4.49
Thursday Treats!,34923,777680,4.49
Kareena pulls of white like no other!,5454,121356,4.49
SPOTTED: Sara Ali Khan in pink!,7319,163412,4.48
🕗Time left: 3 hours! Get Free shipping on all your orders,29863,665890,4.48
Rock n Roll In Rainbow Hued Pants!,33793,754931,4.48
TODAY: Shop Colour Of The Year,25158,562156,4.48
Stay trendy and sporty with these joggers.,13764,307088,4.48
Casual Shirts under 899. Buy Now!,31151,695191,4.48
Black and white edit. Shirts under 899,28701,641148,4.48
Walk The Walk|Trending Transparent Heels👠,31762,708274,4.48
Shop T-Shirt Combos Under 599!,34949,782019,4.47
Meet our Pad Man - Akshay Kumar!,2253,50356,4.47
Here's a chance to make your FASHION DREAM come true!,2650,59223,4.47
Be a celebrity stylist & let your style make you win Big!,3089,69140,4.47
💙When In Doubt Wear Indigo💙,29405,657849,4.47
NEW! NEW! NEW! Get Lucky💘,12750,285115,4.47
Bloom In Florals Now Starting At 350/-,12579,281256,4.47
Here's how to win goodies 🎁upto Rs. 10000 this Valentine's Day❤!,2699,60433,4.47
Fashion Editor's Handpicked! Upto 50% Off,28300,634486,4.46
The Hitlist Of Summer! The Price Drop,30571,684844,4.46
200+ Handpicked Jumpsuits! 💝,12122,271945,4.46
30+ Flared Kurtas On Your Way!🌈,30273,678784,4.46
Shop for FREE! Be in the line of lucky 10. Visit the LimeRoad store!,22790,512531,4.45
"{user_first_name}, Great day to buy! Ltd Stock",33038,742598,4.45
We've Got You The Trendiest Work out Gear,17098,383939,4.45
Summer Stripes Season for Friday Feels!💃🏾,12532,281915,4.45
Shoes to step it up! Upto 70% off,3538,79588,4.45
MAJOR CRUSH ON A GUY? Swipe To Look Hot,31012,697042,4.45
300+ red sarees for the V-day!,14580,327399,4.45
How To Style Your Stripes,34538,776602,4.45
Pretty In Pastels! Shop Tops To Dresses🌸,12404,278785,4.45
Dark florals are IN!,38491,865628,4.45
Print Of The Season: Raging Florals 🌸,12870,289823,4.44
Palazzo Combos Under 799!,10965,247077,4.44
Lightning Deals On Your cart Picks!🌈,11409,256928,4.44
200+ Maxi Dresses! Under 499🌺,12924,291307,4.44
"Hi, {user_first_name}. Guess what?",10568,238347,4.43
"Sweet contests, sweeter giveaways.....",959,21638,4.43
Editor Approved Picks In Summer STRIPES!🌼,28590,644666,4.43
Workwear doesn't have to be boring!,14207,320742,4.43
Say hello to your favourite pair of jeans!,17152,387294,4.43
Cut It Short | Crop Tops😻,12745,287791,4.43
"Only For You, Polo Tees Under 499!",32676,739394,4.42
Sharing love is always a great idea ❤,344,7782,4.42
Be Effortlessly Stylish,15068,340787,4.42
Upto 60% Off On Bestseller,27416,621664,4.41
The perfect sarees for today and every day. What’s your pick?,14316,324581,4.41
Be Always Blooming In Floral Kurtas,35690,809465,4.41
