email_subject,email_open_user_count,sent_user_count,open_rate
1 Shirt 3 Ways To Style To It!,101434,776252,13.07
Leheriya & Kota sarees from Rajasthan!,204527,1564601,13.07
Starting Now: Upto 70% Off From Martini | Free Shipping,4056,31043,13.07
Today's Horoscope! Your Zodiac Colours,93746,717042,13.07
"{user_first_name}, Bestselling T-shirst starting Rs.249!",141004,1079735,13.06
"Hi{user_first_name}, Exclusive kurtas Upto 74% off | 200 shopping credits!",75298,576414,13.06
Get Ready For Your Party In Prints!,168573,1290327,13.06
TIME IS RUNNING OUT😨,8667,66433,13.05
T-Shirts To Shop At Flat 350!,82424,631532,13.05
Girls Won't Stop Staring At You! Shop Look,137836,1056207,13.05
Get Minimum 500 off: Shop stylish kurtas | Free Shipping,374485,2870543,13.05
90's Grunge! Take Away,41116,315119,13.05
There's always room for pink!,1568,12012,13.05
Ready To Hit The Gym!,84778,649724,13.05
It only takes 1 share to win a big surprise,369,2829,13.04
Be a Celebrity Stylist today,8849,67881,13.04
TREND ALERT! Kurtas in Ditsy Florals.,215434,1651491,13.04
Forget the Rules,1741,13356,13.04
Check this out! Check shirts upto 60% off,8325,63837,13.04
All under 800: Must-have kurtas,106179,814976,13.03
90s-era army print is coming for you!,142418,1093245,13.03
300+ black tees at prices like never before!,239180,1835654,13.03
1000 credits added to your account,8387,64430,13.02
Curve flattering flared kurtas! All under 999,16183,124260,13.02
Waking up all night to get lucky? Not anymore!,7739,59487,13.01
Top 10 Pieces You Should Have This Fall!,119452,917826,13.01
You're lucky to get lucky 9 times,8895,68351,13.01
"Get a GOLD COIN, this Durga Puja",7435,57154,13.01
"{user_first_name}, Slash Sale open for all!",589417,4529201,13.01
For December Chill!,34949,268903,13
On Trend Asymmetric kurtas | Free Shipping!,270042,2077122,13
Every Guy Is Buying This!,111241,855463,13
CHECKS & STRIPES |💕Lift Your Look,156232,1202801,12.99
Saree update for Deepika's Wedding!,115016,885595,12.99
MOM is where the heart is! gift her well🌸,38929,299980,12.98
Ripped Denim At Min 40% Off!,94919,731042,12.98
Hi{user_first_name}! What your zodiac says for January 2018 💕.,278862,2148968,12.98
Select the right backpack for your trip.,106944,823646,12.98
Create a Story For the Love of KHADI,6535,50359,12.98
Summer Essential: All Ruffled Up | Free Shipping,88645,683156,12.98
Friendship is caring deeply & SHARING often,1593,12286,12.97
600+ Kurtas By Gerua💞! Upto 70% Off💞,86341,665813,12.97
Somethings Are Just Right When They're Blooming | Free Shipping,46522,358611,12.97
Urgent! Min. 500 Off On Everything!,269035,2075797,12.96
Dear Stylist! We thank you with all our hearts!,2046,15786,12.96
The Denim Fest! Everything at 40% - 60% off,208047,1605118,12.96
Cheers to the freakin print of the season!,36228,279580,12.96
Let's keep the moments forever,1733,13393,12.94
Bestselling styles by your favourtie brands,109957,849790,12.94
"{user_first_name}, Best Selling Kurtas at best ever prices! Buy Now.",194308,1501567,12.94
Buy Sexy Party Wear In Your Budget!💃🏼,2650,20488,12.93
Dress like your Favourite Star this Diwali,127769,988251,12.93
These T-Shirts Are Going VIRAL!,105015,812227,12.93
Must have sunglasses for your next roadtrip!,100550,777803,12.93
10 Shirts You Must Own!,80845,625190,12.93
We're feeling lucky today!,7675,59369,12.93
Your favourite kurtas at the best prices,75986,588203,12.92
400+ Handpicked Tees for the season!,229590,1777304,12.92
From The Style Desk!,138391,1071820,12.91
"Hi{user_first_name}, Kurtas you'll love flat 60% off!",225977,1750976,12.91
Color Block T-shirts starting 499,10808,83689,12.91
REAL & RAW: Style the Bollywood Stars!,5931,45976,12.9
You were created to CREATE,8698,67439,12.9
"{user_first_name}, It's the 699 store | Free Shipping!",212782,1649076,12.9
Rayon Kurtas To Beat The Heat!,115615,896171,12.9
Style Your Denim Jacket In 10 Different Ways!,156194,1211098,12.9
Did you hear about Bollywood's secret love affairs😳?,2237,17338,12.9
Celeb Style! See what Alia Bhatt's wearing!,127431,988972,12.89
Be Warmed Up With Full Sleeve Tees!,246876,1915806,12.89
10 Styles for every Occasion!💃🏼,38556,299181,12.89
Comfy kurtas to lounge all day in,113992,884440,12.89
Janhvi Kapoor in pretty pastels,88474,686174,12.89
We can't stop thinking about your STYLE!!!,1738,13497,12.88
Kurtas that'll make you happy,17465,135580,12.88
Be festive dinner party ready in kurtas!,88929,690278,12.88
Feeling Naughty? SUC* Hot Inspirations! 🔥 Get The Look!,4522,35111,12.88
100+ Blue Formal Shirts Handpicked For You!,94435,733034,12.88
60%-80% Off On Shirts You Like!,376766,2926421,12.87
"{user_first_name}, New year. new things. Under 1199!",6572,51074,12.87
Bestsellers! Don't tell anyone,238362,1854231,12.86
Give a makeover to you happy place...YOUR HOME🏡,6007,46702,12.86
🌈Your Social Calendar Is Here! Shop Brunch!,173762,1351288,12.86
Hi Pretty! Shop Statement Sleeves,38539,299839,12.85
VALENTINE GIFT GUIDE 🎁,78788,613028,12.85
6 Days To Christmas | Shop Sweatshirt,131728,1024923,12.85
January Month End Sale! Starting At 540,31014,241352,12.85
Tops that are trendy now!,34224,266404,12.85
"Hi{user_first_name},Gorgeous kurtas at Flat 50% OFF!",182984,1424097,12.85
Shift Dresses For All The College Girls!😘,35576,276847,12.85
Hood Up For Winter Under 499!,322753,2512313,12.85
You're doing great! Keep Going!,936,7288,12.84
500+ Mandarin shirts for a dapper you,271445,2113845,12.84
For Monday To Friday! Shop Solid Shirts!,142628,1110957,12.84
Wear Your Zodiac Colour!,5818,45298,12.84
The classic Polos under 599 | Free Shipping,102788,800873,12.83
Biker Denims To Own Now! Shop Top 30!,136972,1067723,12.83
🤑Super Saving 🤑!Shop Flared Kurtas,79299,618005,12.83
Maxi Dresses For The Summer | Free Shipping,83220,648696,12.83
Pay For 1 & Get 2 Under 599!,89465,697851,12.82
Are you happy to SHARE?,2032,15848,12.82
The Hottest Embroidered Trend is Here!!!,71381,556678,12.82
Exclusive On LimeRoad 💝 Shop Now,55863,435981,12.81
Only For 6 Hours!,93133,726951,12.81
New New New! Embroidered Tops For Summers,33535,261797,12.81
Ready to think outside the box?,5860,45746,12.81
Make our world nicer by SHARING your love,1735,13543,12.81
"Hi{user_first_name}, It's the Big Freedom Sale! Free Shipping",363459,2839438,12.8
Summer's Top 3! Shop Blush Pink,26311,205597,12.8
In The Blush Of Things!,46999,367114,12.8
It's all about being brave & stylish this season,954,7454,12.8
Kangana Ranaut's kurta is a summer must-have,5443,42544,12.79
Kurta Rush Hour: Flat 399 | Till 12 AM.,68687,537050,12.79
Your Girl Friend Loved These,100675,787311,12.79
Cami tops loved by Karishma Kapoor!,1490,11652,12.79
Kurtas wishlist! Get it upgraded.,130990,1024298,12.79
Red & Black Check Shirts + Free Shipping,154422,1208327,12.78
We're so glad we found you:),720,5632,12.78
What's your lucky hour of the day?,858,6714,12.78
A Surprise Gift For You! {Unwrap Exclusives},136534,1069026,12.77
Style on a budget! Buy 3 kurtas for 999!,186647,1461751,12.77
Note To Self : Shop End Of Season Sale💸.,33599,263194,12.77
Shades Down! Road Trip On!,80843,633229,12.77
One Piece Trend: Jumpsuits Calling📞,36958,289697,12.76
Pretty In Florals! Under 499💞,28849,226100,12.76
5 Types Of Tops Every Girl Needs ✅,36483,285812,12.76
"Dear Valentine, (yes, you!), We think you will love these!",174586,1369635,12.75
"#LimeFresh: 2000+ New Arrivals are here! Shop kurtas, suits & More!",210858,1653275,12.75
Buy 2 for 799! Tees by Rigo & Gritstones | Free Shipping,171215,1343180,12.75
Breaking: 10 Bras You Need NOW 🔥🔥🔥.,181559,1425216,12.74
Your STYLE could get you LUCKY,7918,62157,12.74
Hi{user_first_name}! Click to order now!,30229,237313,12.74
"LimeRoad's NEW GROOVE! 3 for 999 on tops, dresses & more!",40074,314457,12.74
Hand-picked Goodness! Starting 899,5050,39655,12.73
A-line Kurtas To Flatter Those Curves! Trending Now!,173024,1359655,12.73
"{user_first_name}, Hot new kurtas of the season | Shop new!",173723,1364951,12.73
Buy 1 Get 1 Free on your favourites,441440,3467852,12.73
The Diwali sale is on!,38507,302597,12.73
Don't watch the clock,1732,13615,12.72
Casual shoes upto 70% off,11103,87263,12.72
Twist and twirl in maxi dresses!,172291,1354491,12.72
Waiting to receive your love❤,1322,10392,12.72
What are you SHARING today?,1519,11941,12.72
Time For Some Happiness!,85343,670758,12.72
In Vogue!!!! WEAR THE TREND,28700,225809,12.71
The 699 store is live!,308156,2424617,12.71
Never repeat an outfit: kurtas at flat 599,151733,1193906,12.71
HOW'S THE JOSH! ... HIGH SIR!,102797,809478,12.7
Tops Starting At 350!,31889,251058,12.7
The Summertime Sale is Live!,178636,1406818,12.7
Saturday Night feels | Steal everything under 499!,76309,600958,12.7
200+ Sneakers in bright hues!,122661,966654,12.69
6 दिन 6 शर्ट? One for each day!,121554,957534,12.69
Summer Calls For Florals! Woah,102498,808008,12.69
5 Hollywood Movies to Binge Watch!,182483,1437646,12.69
6 types of kurtas to own right now!,555031,4374670,12.69
Start Your Day With A Bit Of Shopping!,85385,673551,12.68
Best Sellers! Selling Away Fast!,93362,736049,12.68
Stylish Steals Starting 349,36421,287506,12.67
Because there's no time to stop!!!,8412,66392,12.67
Heart melting discounts only for you. Explore our top offers!,130289,1028519,12.67
Find Your INDIGO Love💙In These Fav Kurtas,84878,669897,12.67
Major floral love affair | free shipping,43108,340285,12.67
Just the nightwear you're looking for!,2614,20636,12.67
"Opt for simple, clean silhouettes.",66989,528863,12.67
Current Obsessions! Ruffles,74567,589015,12.66
Cozy Weather??,41272,325880,12.66
Hand-picked Jewel-toned block printed kurtas,140144,1107180,12.66
Get Ready In Style: Shop Blazers,127852,1009618,12.66
Kurtas that are oh so flattering!,364188,2877648,12.66
Add That Sprinkle Of Sexy With V-Necks,5001,39502,12.66
It's a perfect day to SHARE,388,3065,12.66
Denims & Distressed Denim Under 999!,89145,704029,12.66
Irresistible Winter Hued Kurtas!,188699,1490486,12.66
"Summer tees in blue, black & white",132890,1050442,12.65
Editor's Picked Layered Kurtas For You! 💖,88799,702214,12.65
Straight Kurtas Are So Hassel Free! 🤗,77485,613031,12.64
One outfit away for a full score! Hurry,133515,1056368,12.64
Everything stylish & traditional: Shop Rakhi special,131681,1042010,12.64
Top 5 A-line Kurtas To Stun In! 🔥,84629,669872,12.63
Wear Your Pride 🇮To Sacrifice & Progress!,46721,369958,12.63
The world wants to see your amazing STYLE!!,8624,68266,12.63
HAPPY HOUR - 8 PM to MIDNIGHT!,266410,2109464,12.63
Did you hear? 📣Buy 1 & Get 1 for Re.1!,285663,2262172,12.63
Valentine Special! Dress In Red,32158,254544,12.63
200+ trending sarees from Rajasthan,115120,911321,12.63
Create the Style you've always wanted to CREATE!!!,7628,60417,12.63
The New look! Persian Florals for Eid,170176,1348674,12.62
They Are In Demand!,90057,713553,12.62
Sacred Games! BACK AGAIN!!!!,7546,59817,12.62
Curve flattering flared kurtas! All under 1499,21512,170431,12.62
The classic Polo tees starting 499,8129,64413,12.62
Kangana's Manikarnika Saree Look In Trend,7856,62263,12.62
Hot off the runway: All your favourite brands,120058,951975,12.61
Min. 500 Off On Everything! Hurry!,106536,844842,12.61
What's for you this month?,1134,9000,12.6
#Limeroadexclusive by Kargha,129025,1024034,12.6
Best selling denims at best price!,70411,558959,12.6
Shared joy is a double joy!!!!,3079,24429,12.6
Men in Black - Steal their style!,212192,1683827,12.6
"Hey there TV buff, here's your chance to win",8535,67762,12.6
Outfits for your Girl Gang! Shop Classics,90207,716357,12.59
Sale Take Away! Shop Kurtas,106491,845558,12.59
Nothing To Wear? Check Out The Dresses & Jumpsuits,99102,787374,12.59
Don''t let the rains dampen your STYLE!!!!!,8452,67136,12.59
"Hello, comfy T-shirt dresses!",2619,20800,12.59
Leheriyas: The print from Rajasthan,83063,660302,12.58
Kurtas Sets Everyone Loves,115698,919662,12.58
Time to get some checks in your wardrobe!,66232,526368,12.58
Everyone is eyeing these 2018's bestseller,115788,920380,12.58
90% of girls are drooling over this!,38008,302084,12.58
"{user_first_name}, 200+ New & Trendy Kurtas Handpicked For You",206198,1638658,12.58
Life is all about SHARING,1746,13879,12.58
Unbox the love!,38059,302507,12.58
Sling bags you can carry everywhere! Flat 65% off | Free shipping!,109481,869934,12.58
"{user_first_name}, 499 Shoe Store handpicked for you!",298132,2369874,12.58
OPEN FOR SUNDAY DEALS 💥,73440,584066,12.57
Your account has been Credited! 200 shop credits on order of 1199!,600744,4780483,12.57
The newest new sarees handpicked For You!,18922,150637,12.56
Here's something no one ever told you before,887,7064,12.56
"Hi{user_first_name}, Exclusive kurtas Upto 65% off!",77009,613051,12.56
"Pretty Pleats, Please! ❣️Shop Collection",51167,407556,12.55
Do what you love!,7495,59741,12.55
Minimum Rs.500 OFF: 233 Handpicked Kurtas for you!,490147,3904986,12.55
📢📢📢The Best Seller Are Here,84454,672876,12.55
50 Handpicked Party Suits| All under 999!,192211,1531825,12.55
Time spent playing for children is never a waste,906,7225,12.54
Ikat Weave best seller Kurtas for you,94923,757002,12.54
So Much To Steal!,96008,765724,12.54
200+ Black Tees handpicked for you,58457,466036,12.54
Must have dupattas this festive season | Free shipping,149070,1188634,12.54
Tees in black & white starting 349,153460,1224071,12.54
Hand-selected bordered sarees for every occassion!,6841,54585,12.53
Maxi Dresses + Upto 80% Off + Sexy Styles,27155,216690,12.53
10 Type Of Shirts You Need To Know!,182515,1457160,12.53
Most Loved 9 To 5 Kurtas! Rule Your Work👩🏻‍💻,82572,658828,12.53
Summer Holiday fashion Edit,83163,664409,12.52
Click To Know Your Queen! ♟,34426,275033,12.52
Don't share your fries but share your style,325,2596,12.52
Handwoven Sarees are the Biggest Trend right now!,156325,1248561,12.52
Last Day of Republic Day Sale!,137401,1098144,12.51
As Fresh As A Lily 🌷 Shop Fresh Dresses!,155529,1242760,12.51
It's a Sneaker pop-up shop!,127052,1015436,12.51
Bollywood yummy mummies and their killer style 🔥,1959,15674,12.5
Stylish Dresses You'll Love!,73654,589288,12.5
Short days. Long sleeves! Under 499 | Free shipping!,269690,2157104,12.5
Party Night! Shop Collection,114758,918168,12.5
Day In A dress! Take Away,37637,301137,12.5
How do we show that we care?,318,2543,12.5
Editor's picks for your sister's wedding,117138,937161,12.5
Let's Talk Tops & Tees!,49919,399302,12.5
Get the one you like the most.,84004,672029,12.5
It's The Final Countdown!,104896,839129,12.5
Check Out For Checked Shirts!,505694,4049393,12.49
Be a Celebrity by just SHARING a look!!,1023,8191,12.49
Shop What's Hot,123391,987591,12.49
"Hi{users_first_name}, 3 Kurta trends to try right now!",172737,1383387,12.49
It’s Raining Discounts🌟,37260,298350,12.49
Winter Edit! Shop Collection,37181,297884,12.48
How good do you want to be today?,1214,9726,12.48
All the must-have denims under 999,156169,1251424,12.48
6 दिन 6 जूते? One for each day,423543,3394753,12.48
10 Shirts You Must Own! Shop now,90528,725654,12.48
Bare The Shoulders! Shop Brand New Styles,37418,299889,12.48
#Ranbir Kapoor as our Sanju Baba! Style his new look!,1600,12826,12.47
Best selling denims at best price,6193,49665,12.47
🕗Time left: 3 hours! Get Free shipping on all your orders!,1577761,12652385,12.47
12 Essential Shoes For Every Occasion! Get Started!,170918,1370886,12.47
"{user_first_name}, 1 check shirt, 3 ways to style it!",246031,1972852,12.47
Treasures from Rajasthan: Bandhani & Leheriya Sarees! Shop Now,203448,1633025,12.46
Buy1 And Get 1 Free!,108964,874662,12.46
Florals you absolutely cannot miss,157040,1259974,12.46
"Love, Share & Be Happy!!!!!",1591,12766,12.46
The subtle art of Layer on Layer | shop trend,6833,54857,12.46
Mark your entrance with these boho looks,6738,54134,12.45
Surprise Sale Has Started Now! ____%Discount,82530,662908,12.45
Leather strap watches you can wear all day | Free Shipping,6530,52448,12.45
Rock a Bandhgala like Saif Ali Khan,4307,34595,12.45
Full sleeves for the cold days!,233450,1874966,12.45
Y-E-L-L-O-W--- Colour of the day!,32906,264423,12.44
Standout in these kurtas even at workplace,175611,1411337,12.44
"""IT'S BIGGER & BETTER"" #WINTER SALE#",113862,915416,12.44
Sharing love is more than a gift,1652,13290,12.43
Beautiful minds inspire others!!!,1704,13709,12.43
Top Of The Lot With The Latest ✨,41731,335801,12.43
Colour pop Kurtas for Rain & shine,195309,1571088,12.43
Love for flares! shop kurtas,14925,120143,12.42
Call to Action! Shop Trends,24188,194783,12.42
End Of Season Sale is LIVE! Start shopping | Free Shipping,173846,1400209,12.42
Trending Now: #140 Sexy Dresses Starting 399 | Free Shipping,40711,327743,12.42
What do you do when you love?,554,4465,12.41
Open This Right Now!!!!,113733,916277,12.41
Newest Of The New! Starting at 350,32226,259675,12.41
Hi{user_first_name}! {no_of_users_viewed} users have their eye on your find!,29622,238874,12.4
Siddharth & Parineeti: The Zabardast Jodi of Bollywood!!!!,8534,68850,12.4
50+ Bomber jackets just for you!,180809,1458094,12.4
Exclusively Just For You! Denims By Levis!,6471,52206,12.4
Good News for all the TV BUFFs!!!!!,6720,54221,12.39
It’s Raining Discounts🌟 40-60% Off + Free shipping,53357,430738,12.39
Get casual with these shirts @ 599,256039,2065768,12.39
800+ Best Seller Kurtas Upto 70% Off 🌸,89447,722067,12.39
Kota Sarees! For a touch of elegance,129415,1045071,12.38
"Hi{user_first_name}, selected {color} {category} for you! Don't Miss",1612911,13028227,12.38
Because playing dress-up never truly ends!!,10307,83274,12.38
Everlasting Styles! Shop Kurtas,118711,959747,12.37
Summer Tees in your favourite colours,28160,227886,12.36
Gifts For 'Him' Valentine Special💞,28911,233870,12.36
6 types of tees you need right now!,154710,1252105,12.36
6 Hours Left!,9887,79970,12.36
Hot Weather Dress Checklist 🔥 Shop Dresses!,52219,422839,12.35
For The 💙 Of Denim! Shop 👕👗👖.,53713,434751,12.35
Vogue Trends Only For You! Go Girls,34846,282182,12.35
"Hi{user_first_name}, 200+ Kurtas for day and night!",353406,2861091,12.35
PRETTY PLEASE! 💝 Dresses Under 599!,48639,393825,12.35
Dress it up! Shop maxi dresses,33257,269527,12.34
Statement Jackets! Warm Up,35976,291638,12.34
Happy Sale: Min 200 off on everything #GetExcited | Free shipping!,208450,1688797,12.34
New & Trendy Under 499!,34180,276932,12.34
What to wear to the beach,127074,1029891,12.34
Lace tops & dresses you need to buy,36897,299096,12.34
Grab Your SMARTPHONE Now!!!!!,7901,64013,12.34
Find out what's on the other side of the door,8484,68791,12.33
Freshly brewed styles handpicked for you,98429,798357,12.33
Evening wear Suits we love! Shop the must haves,18930,153557,12.33
Hello... It's Us! Min. 500 Off On Dresses! Woop! Woop!,51326,416337,12.33
Dress Up Your day! Shop Dresses,70890,574810,12.33
Never repeat an outfit: shop chic kurtas,6712,54449,12.33
Buy 1 Get 1 Free- Whaaa!,428445,3476855,12.32
Sunday Hitlist: Statement Solids You Need NOW | Free Shipping,43660,354400,12.32
We're most alive when we SHARE,1666,13522,12.32
Denim Shirts You Can Wear Straight For A Week!,97031,787683,12.32
150+ Bestselling Under 399/- 😍,30273,245902,12.31
"This RAKHI, get LUCKY",8052,65470,12.3
Jingle Bells! Shop In Sale,36100,293468,12.3
Flat 299 Store! Style It Up!,105856,860543,12.3
Who is your favourite Beti of Indian TV?,8073,65612,12.3
The 399 Store Is Here!,547292,4448604,12.3
Beat The Monday Blues With Hand-picked Styles!,66170,538609,12.29
Season Styles To Covet! | Fall In Love,41632,338831,12.29
The best way to get over Holiday blues,108460,882581,12.29
🥁Go Home Or Go Street Style 🥁,94196,766187,12.29
Buy your Favourite Kurtas starting 799,17422,141793,12.29
6 types of kurtas to own right now + Free shipping,136442,1109927,12.29
"Hi {user_first_name}, Doll up your kids this season! 🎀",39629,322440,12.29
Floral Pink For Valentine!,30907,251618,12.28
"🕗Tick, tock! 3 HOURS LEFT to use your 200 shop-credits! Hurry!",258941,2108536,12.28
200+ bestselling styles of the season,108153,880863,12.28
"{user_first_name}, 6 types of must-have Footwear! Check'em out!",381314,3104617,12.28
Kasautii Zindagi Kay Special!!!!,7892,64309,12.27
"The product we reserved especially for you, is waiting to be picked!",29306,238911,12.27
#358 Cotton Kurtas at Lowest Prices Ever!,69460,566274,12.27
In Love With STRIPES For Summers!🌻,35278,287650,12.26
Our top brands have made more reductions,11220,91508,12.26
Your Cart Misses You! Shop Now!,112215,915111,12.26
Best Watch Combos under 499 + Free shipping,160867,1312505,12.26
For A Lovely Day! Pastel Love! Shop Tops,52771,430546,12.26
17 Getaway-Ready Weekender Duffle Bag!,105648,861807,12.26
Tops & Dresses you'll love! Upto 70% off | Free shipping!,36498,297803,12.26
4 Types Of Tops Every Girl Needs ✅,144516,1178521,12.26
Easy Palazzos For Spring! 🌼.,80078,653156,12.26
every celebrity is wearing this!,91033,742688,12.26
Multiply your happiness by SHARING,1559,12722,12.25
Go crack a clearance sale!,120161,980604,12.25
Rs.{credit_given} added in your account! It's free shipping too!,6431,52507,12.25
Sara Ali Khan in All Black!,32472,265127,12.25
Fresh & new kurtas for you #LimeFresh!,186609,1523252,12.25
You have the power to get lucky every hour!,7316,59711,12.25
Lovely Linen Sarees Just For You!,200391,1636986,12.24
Welcome To The Biggest Sale Ever!,107027,874364,12.24
The Perfect Tux For Your Perfect Night!,124913,1020141,12.24
50 Handpicked Anarkali Suits for you!,8560,69923,12.24
You Have Got A Minute To Win It!,94642,773277,12.24
Save upto 80% on top-selling kurtas,125705,1027889,12.23
We're so glad we found you,6134,50173,12.23
OPEN>CLICK>SURPRISE,269951,2207305,12.23
Best Deals! Flying Away Soon! Min.500 Off!,128561,1051015,12.23
Style the youngest spy of Bollywood!,1409,11517,12.23
"Father's Day Special: Get a gift of love for your hero, Your Dad!",1709,13979,12.23
Best selling kurtas at the best prices!,104774,856416,12.23
Good News: We're hiring again!,903,7392,12.22
Upgrade Your Style! Shop Collection,43167,353318,12.22
"Hi{user_first_name}, On Trend Kurtas: Buy 3 For 999 Only!",168997,1384082,12.21
Nama-Slay! Enjoy Min. 40% Off On The Best | Free shipping,42402,347287,12.21
The greatest power is the power to SHARE,343,2809,12.21
Top selling kurtas at best prices,80424,659231,12.2
The Flat 400 Store Is Here Only For Today!,103497,848564,12.2
Denim Shirts Are A Must Have!,254202,2083668,12.2
Love For Dresses?,35830,293775,12.2
Think in Black. Masterclass is back!,1851,15177,12.2
Dress like your favorite celeb this diwali,115310,944911,12.2
"Hi{user_first_name}, It’s the season of check shirts!",257586,2111584,12.2
Today's Special!,36977,303348,12.19
Today's Style Fix: Kurtas at min 50% OFF!,183271,1503696,12.19
Exhilerating prints just for you!,40917,335616,12.19
Getting Cold Dear?,32056,263067,12.19
Time For POP UP SALE! Crazy Deals🌸,36319,298199,12.18
Discounts Overloading! Upto 60% Off,147414,1210730,12.18
Everything you need at Flat 399!,301750,2477047,12.18
"The more you SHARE, the happier you are!!",1281,10513,12.18
Priyanka Chopra giving us the Chills!,86595,711148,12.18
Love only grows by SHARING,328,2693,12.18
Do small things with great love❤,1427,11720,12.18
Take time to make your soul Happy:),1465,12040,12.17
Under 999: Cotton kurtas to beat the heat!,6924,56909,12.17
"Hi{user_first_name}, 200+ bestselling tops for you | Free shipping!",163006,1339506,12.17
Style the Bhai of Bollywood & WIN big!,1716,14101,12.17
800+ New Tees handpicked for you #LimeFresh!,196721,1616806,12.17
"This Rakhi, win Upto Rs. 5000 Shopping Credits",8354,68643,12.17
We can't get enough of your amazing STYLE!!!!!,8592,70611,12.17
"Bigger The Size, Bigger The Discount !",86026,706805,12.17
Your kurtas wishlist just got a upgrade! ❤,292909,2408896,12.16
The chance to preview New Collection ..,50110,411981,12.16
Know the perfect shoe for every sport,97823,804696,12.16
Madness sale has been extended! Only for today!,538310,4426812,12.16
Work ready kurtas at flat 399!,173965,1430333,12.16
This Versace Perfume could be yours!!!,1879,15449,12.16
Sania Mirza spotted in a IKAT kurta!,5249,43208,12.15
Monsoon Favourites! Make A Solid Statement,36427,299837,12.15
Handpicked Kurtas for you! Flat 50% off!,4196,34530,12.15
All New & Trendy! Shop It Baby,37441,308175,12.15
Kurtas at Flat Rs.500!,95441,786081,12.14
Good looks aren't meant to be stored,307,2528,12.14
Editor's Picks! Block-Prints,134296,1106513,12.14
"Love what you do, do what you love",5513,45397,12.14
#2019 Takeaways👗,35672,294129,12.13
"Hi{user_first_name}, Your New 9 to 5 shirts!",246489,2032193,12.13
Exclusive Kurta Collection for Diwali!,17625,145259,12.13
10 shoes every guy should have for summer,145076,1195595,12.13
90% Of Girls are wearing these on V-Day!,26715,220317,12.13
How to start the week?,482,3973,12.13
Easy To Wear Henley Tees,193199,1592575,12.13
200+ Styles to wear all summer,109488,902554,12.13
You know you want these printed tees + Free shipping,231667,1909119,12.13
A-line kurtas for day and night!,115862,956205,12.12
5 Type Of Shorts You Need To Have!,90202,744425,12.12
The 499 Store: Fresh New t-shirts!,242639,2002198,12.12
"{user_first_name},1 white shirt, 3 ways to style it!",206595,1704603,12.12
Trendspotting: Asymmetric & Layered kurtas!,70940,585316,12.12
Your best friend's wedding?,113256,935115,12.11
Must-have denims starting 999,8463,69889,12.11
