email_subject,email_open_user_count,sent_user_count,open_rate
Can you smell what The Rock is cooking?,71550,182821,39.14
Go Monochrome! Shop Black & white shirts,90103,240445,37.47
Dress up for work! Shop Office wear essentials,89214,246502,36.19
Hey Sharer! It's a brand new TV for you this time!,716,2011,35.6
Trend Alert: Tropical Floral Kurtas for Monsoon,97827,275391,35.52
Here's how to win big in October!,857,2414,35.5
Summer whites for hot days,176904,505422,35
"Hi{user_first_name}, Season's favourite Floral kurtas for you",25546,73489,34.76
We have something for you {user_first_name},5753,16620,34.61
🎀 Shop Our Bestselling Styles,30450,88336,34.47
What's Good? The Big Price Drop,19576,56980,34.36
Summer ready sarees Flat 70% off,89344,261185,34.21
So. Many. Tees. Handpicked For You.,66181,195670,33.82
"Happy Birthday, Superman! Steal his style",108109,321155,33.66
To hard to believe😱,695,2100,33.1
Ready? Set.. SHARE,772,2346,32.91
Meet The Perfect Top!,30278,92885,32.6
Go on a shopping spree at The Price store,103284,320500,32.23
We can't wait to Congratulate you☺,723,2253,32.09
Hit The Jackpot 🎰,19973,62998,31.7
Hot new kurtas by Kargha #LimeroadLaunch,83677,264959,31.58
Limeroad Exclusives at never before discounts,105159,337199,31.19
"Today, Think NEW! Gingham Checks!",27444,88425,31.04
#TrendingRightNow - Denim shoes,65580,212157,30.91
The Best Off-Shoulder Tops & Dresses You Will See,2093,6833,30.63
A Brand New TV is just one click away,701,2293,30.57
New month & a new surprise🎁,1024,3367,30.41
"{user_first_name}, Hit The Jackpot 🎰",2059,6875,29.95
Do what you're best at. Inspire!,1061,3567,29.74
All things nice and warm inside,684,2312,29.58
Kurta dresses for the best-dressed at work,143838,490557,29.32
12 days gone. Still waiting?,726,2490,29.16
"Congratulations to the winners of the ""Lucky 7"" Contest!!!!!!",797,2740,29.09
Clap along! It's The Happy Sale!,61233,211832,28.91
Let the world discover your Style. Start Sharing,1259,4375,28.78
Check out your plan for tonight!!,659,2297,28.69
Share the love❤,741,2585,28.67
Handpicked Kurtas for summer,136215,475759,28.63
NEW Rugby Tees are here!,15086,52885,28.53
"Sharing is fun, sharing is easy",1073,3784,28.36
6 types of tees for you,138328,489463,28.26
Care to share?,1071,3808,28.12
60% OFF on NEW ARRIVALS,15098,53750,28.09
You're one step away from winning a Brand New TV,1047,3739,28
2 things you can only share with your bestie,947,3404,27.82
Sharing! Tick this off your Sunday checklist,753,2725,27.63
Congratulations! You have just received {amt_credited} purchase credits.,2880,10424,27.63
4 Key Pieces for the new season,134553,490583,27.43
"If four was more, you could have waited",696,2554,27.25
Dress Like You’re Already Famous,15011,55575,27.01
Malhotra's look is apt for Work From Home,15461,57701,26.8
Next Thing For You: A Microwave Oven!,551,2065,26.68
ALL NEW summer shorts!,15440,58105,26.57
Somethings never come back,695,2625,26.48
Summer tees for warm weather,79076,300477,26.32
Gold Digging?Get the Gold,649,2485,26.12
"Hi{user_first_name}, New lingerie just arrived!",38880,148849,26.12
Hooded t-shirts under 499!,171347,658001,26.04
It's all about winning GOLD,669,2575,25.98
Hot new kurtas by Kargha,3657,14074,25.98
It's the last month of 2018.,735,2830,25.97
"{user_first_name}, Must-have Casual Shirts",110998,427677,25.95
Get dress for work,117800,455891,25.84
Our Bestselling Tops Are Here,15687,60920,25.75
Cotton silk sarees for summer,67089,260642,25.74
kurtas for work to weekend,44772,175380,25.53
Share & Inspire❤,831,3262,25.48
"It's a ""Share"" kinda day",616,2418,25.48
Bestselling sarees for Summer,43413,170800,25.42
Everyday t-shirts at flat 449!,221174,876417,25.24
7 outfits. 7 Hrs! Are you lucky to win?,684,2740,24.96
"Hi{user_first_name}, 2018's hottest trends are here!",41371,166962,24.78
Layers for the winter season! Shop shrugs!,5789,23361,24.78
All things grey & white for your wardrobe,209535,846266,24.76
New arrival bhagalpuri sarees,150939,609814,24.75
The hottest Rani Pink sarees,51588,208488,24.74
FLAT 70% off: shop 200+ kurtas,40854,165178,24.73
Head to toe in style,114514,463708,24.7
Bzzzz.......Don't be a busy bee,986,4001,24.64
Kargha! Exclusively on Limeroad,127882,525472,24.34
Everyday Kurtas at best ever prices,161993,667058,24.28
Playful Flared Kurtas Just For You,157607,651050,24.21
Hey! It's a Sweet One,51565,213172,24.19
Are we seriously breaking up💔,538,2229,24.14
"{user_first_name}, Freshly brewed styles handpicked for you",127313,529222,24.06
{likers_name1} liked your look,4532,18882,24
They're new. They're trending.,4112,17172,23.95
The denim fest! everything under 999,207521,867643,23.92
Budget Buys: Kurtas handpicked for you,207631,868036,23.92
Check out Siddhant Chaturvedi's sporty looks,13900,58434,23.79
New Polka dots tees are IN,13996,58880,23.77
200+ Best-selling Kurtas | Free Delivery,125948,531748,23.69
Sharing is cheaper than therapy,668,2824,23.65
"{user_first_name}, everything that's hot & trending",198687,843984,23.54
Tuesday's best handpicked styles for you,56606,240787,23.51
Win a....?,518,2208,23.46
Hand-Picked Shoes Just For You!,194005,827636,23.44
Trousers in beige & brown,144154,616818,23.37
"{user_first_name}, Experience Extra 15% off on all orders! Only on updated app!",95715,410574,23.31
200+ Traditional sarees we love,101977,438044,23.28
Casual trousers for work & Play! Fill those carts NOW!,200761,865337,23.2
Denims in the shade of Black & grey,123006,531864,23.13
Shawn D'souza is crushing on T-shirts!,228325,989292,23.08
All about prints & checks! Shop casual shirts,122678,531880,23.06
Share today and keep your worries away,512,2225,23.01
The hottest offers for Sunday | Free Delivery,290559,1264348,22.98
It's a Dussehra special! Get In,230153,1003745,22.93
Top 20: Best New Picks,43809,191279,22.9
"Play with lines , Get casual shirts | Free shipping",218300,953068,22.9
Things We Loved In #SonamKiMehendi,21551,95041,22.68
Twirl in Dresses!,38353,170062,22.55
"Hi{user_first_name}, New Styled Bottoms for a Trendy Look",119290,529498,22.53
Naughty Knotted! Shop Shop,60880,270561,22.5
New Tops Alert! Get Shopping!,25156,111949,22.47
So. Many. Tees. Flat 399,237755,1058287,22.47
Editor's picks - tanchoi banarasi sarees,133136,593713,22.42
Start Working Out ! Upto 60% off on sport shoes,195810,875496,22.37
Trending Kurtas to wear right now,46854,209616,22.35
Flaunt these banarasi dupattas,129788,581491,22.32
It's a win win: LR Gold Membership & so much more!,627,2811,22.31
Sarees to wear when it's HOT,118026,529241,22.3
Stop EVERYTHING! Up to 50% off ALL Dresses,14964,67194,22.27
Enter into 2019 with new things! Yayy!!,499,2252,22.16
#TrendingNow: Raglan Tees,246952,1114820,22.15
Summer tees to keep you cool,150623,680027,22.15
Must have essentials for every wardrobe,191196,863753,22.14
"Everyday style, sorted!",213995,967510,22.12
Ready for festive season,182882,827365,22.1
Shop The Ultimate: Tops & Dresses,52429,237898,22.04
Linen sarees work to play,138901,631066,22.01
Hi! Let's talk style: Tops at Flat 399!,40447,183833,22
#MeghanMarkleXPrinceHarry10 Days To The Royal Wedding,2738,12443,22
"{user_first_name}, Summer Tees by Gritstones",107476,489250,21.97
"{user_first_name}, Anarkali Kurtas to twirl in",162575,741224,21.93
Rethink your cami tops!,3848,17609,21.85
"{user_first_name}, Casual shirts you can wear to work",265863,1216754,21.85
It's all Black & white! Shop tees,11549,52890,21.84
Bestsellers at best prices,310965,1425543,21.81
B-town's lockdown essential? Books!,14262,65538,21.76
Gear up for the biggest surprise this month,750,3447,21.76
"Hi{user_first_name}, Casual shoes under 499! Shop Now",241649,1113478,21.7
Monday Blues? Find out what to do!,438,2021,21.67
To Fitness Days! Shop Active Wear!,52130,240531,21.67
Of Checks & Stripes! Shirts under 799,189721,882240,21.5
The best thing to do in 2019?,733,3418,21.45
Make a statement with tiered kurtas,126840,594268,21.34
Be summer-ready like Janhvi Kapoor,14245,66926,21.28
"Hi{user_first_name}, Summer’s favourite Kurtas handpicked for you",251984,1188200,21.21
Statement Sleeves Are All The Rage!,45867,216446,21.19
Trend Alert: Shop Micro Florals!,48246,227812,21.18
Of Checks & Stripes! Shirts under 999,11672,55140,21.17
Soha Ali Khan's floral kurta is worth a shot!,14503,68607,21.14
On-trend styles by Being Fab! Flat 549,136229,645155,21.12
It's okay to be a little obsessed with Sharing,464,2198,21.11
"Happy Birthday, Harry Potter!",232868,1105084,21.07
100+ Bestselling Kurtas 👗,86368,410112,21.06
500+ mandarin shirts for summer! Shop Now,221530,1052891,21.04
Back To Basics: Shop Kurtas,132373,630073,21.01
Mini skirts all the way! Shop skirts,44349,211091,21.01
Casual shirts in solid hues! Min 40% - 60% off,247796,1180107,21
"{user_first_name}, Handpicked Tees for summer",22795,108630,20.98
Bestsellers at lowest ever prices!,180831,862411,20.97
So. Many. Things. at never before prices,117452,560317,20.96
Handpicked casual shirts for everyday,234996,1127631,20.84
The classic Polos starting 499,821,3942,20.83
Check this out! Check shirts under 899,237054,1138400,20.82
Exclusive on LimeRoad! Shop Now,30079,144444,20.82
"Buy 1 Get 2 FREE, price store or 80% Off + Free shipping",415980,2002231,20.78
Washed Denims for a cool vibe! Upto 60% off,246638,1186847,20.78
Be the reason someone smiles today,430,2070,20.77
Coming In Hot 🔥,14731,71144,20.71
7 Hrs. 7000 Free Shopping Credits!,442,2134,20.71
You inspire millions of women across the country!,467,2261,20.65
Dress Your Feet Formally,204080,988474,20.65
Casual trousers to look sharp in! Upto 65% off,13850,67175,20.62
Dress it up! Shop Ties & bow ties,200019,972106,20.58
Something new for you in 2019!,527,2564,20.55
🌈 Clearance Sale | Min. 70% Off,74023,360473,20.53
Casual shirts at best ever prices,10924,53317,20.49
"Be giving, enjoy SHARING",832,4068,20.45
Work ready kurtas at flat 399,33912,166146,20.41
Everybody loves SALE! Shop Kurtas,120157,588953,20.4
"{user_first_name}, Get the Layering right this season!",185539,912715,20.33
"Hi{user_first_name}, Summer Tees - Buy 2 for 799",213281,1049637,20.32
6 types of on-trend tees | Free Shipping,213230,1049478,20.32
Summer's coolest Polos! Shop Now,9068,44679,20.3
Is SHARING your favourite thing?,1039,5127,20.27
Show us what's in your sharing list,486,2399,20.26
The Best Of Polka Dots & Stripes,16988,84114,20.2
"Make a SOLID statement, shop kurtas at upto 80% off",111092,550129,20.19
"{user_first_name}, 3 easy ways to wear Indigo this season",149574,741304,20.18
Happy Birthday to the little bollywood munchkin Taimur❤,508,2518,20.17
"Less whining, more winning!",602,2997,20.09
6 types of tee you need to own,139633,694908,20.09
The classic Polos upto 60% off | Free Shipping,11000,54808,20.07
#TrendAlert: Raglan tees! Under 699 | Free Shipping,219671,1096350,20.04
Summer tees Buy 2 for 999 | Free shipping,26413,131853,20.03
Party shirts that you just can't miss,243486,1215574,20.03
Tees in a bunch! combos starting 499,833,4161,20.02
Shop 2 Tees Under 599!,11216,56164,19.97
150+ Fresh & New Pieces Of Denim You Cannot Miss,1352,6772,19.96
"{user_first_name}, Bestselling tees for summer",3782,18963,19.94
All the Shades of Grey you need,255927,1284586,19.92
Kurtas you'll be happy to own!,90331,453412,19.92
You're the Winner!,3239,16281,19.89
Brunch Day! Shop Tops & Dresses,41916,210885,19.88
All things hot & trending by Cobb! Flat 60% off,9654,48686,19.83
We're trying to connect to you......,803,4055,19.8
It's raining diamonds💎,412,2083,19.78
Meet our Smartphone winner Priyanka!,441,2232,19.76
Never too late to workout! Shop sports shoes,221048,1120480,19.73
6 Types of T-shirts Every man needs | Free Shipping,33413,169428,19.72
What did you just see?,1015,5146,19.72
Feeling lucky again? We bet!,465,2360,19.7
FINAL CALL! You still have 1 last chance. HURRY...!!!!,676,3447,19.61
Stylish work attire upto 60% off,129553,661834,19.57
Festive Trends in Kanjeevarams,110422,564324,19.57
200+Full sleeve tees you can wear all year long!,216007,1104251,19.56
Stunning Maxi Dresses You Cannot Get Enough Of!,56552,289125,19.56
Share. Win. Repeat!,415,2124,19.54
Share & see the magic happen,670,3431,19.53
"Hi {user_first_name}, Bandhani & Leheriya sarees handpicked for you",233441,1195983,19.52
"Hi{user_first_name}, Casual shoes upto 70% off!",12293,63006,19.51
4 ways to style your blue Kurta this summer,139104,713645,19.49
"{user_first_name}, ALL NEW DRESSES just dropped!",49992,256517,19.49
"Skirts for summer, baby",33257,170694,19.48
Handpicked shirts for budget lovers,127669,655340,19.48
Short Kurtas Just For You,199297,1024176,19.46
Make this Lohri a fun-filled one!,429,2204,19.46
Shirts in checks & stripes for everyday! Upto 60% off,228079,1172903,19.45
The Denim fest! Min 40% - 60% off | Free Shipping,235341,1211310,19.43
"{user_first_name}, T-shirts is set of 2! Start shopping",233230,1201818,19.41
"Hi{user_first_name}, Stylish Kurta dresses for that Monsoon date!",230282,1188180,19.38
Your last chance at the bestsellers | free shipping,65776,340316,19.33
#TrendingNow: Colour block tees,12204,63167,19.32
"{user_first_name}, Dresses while you wait for your order!",8382,43406,19.31
Get rid of your Saturday Scaries!!,391,2032,19.24
M is for MADNESS! Shop from the craziest offers ever.,541824,2816658,19.24
"Just Arrived: All new sarees, get them first!",208078,1082005,19.23
Of Checks & Stripes! Shirts under 999 | Free Shipping,9992,51985,19.22
#TrendAlert: Washed denims under 999 | Free Shipping,176893,920440,19.22
Tropical floral kurtas to wear right now,108102,562456,19.22
"Block print kurtas, trending right now",10349,53884,19.21
"{user_first_name}, Kurta & Palazzo sets upto 80% off! Shop Now",6204,32299,19.21
Chic block prints kurtas on a budget,186752,973843,19.18
"Buy 2 for 799! Shop tees, watches & sunglasses",177149,924051,19.17
The Half Price sale! Flat 50 % off on everything,184758,965039,19.15
Start Early This Mother's Day 💌,11645,60834,19.14
Use your super power today! Start Sharing!,391,2043,19.14
#TrendAlert: Washed denims upto 60% off,8520,44568,19.12
Tis' the season to wear stripes!,5637,29477,19.12
Ranbir kapoor as Sanju! See his look here,203218,1064366,19.09
Solid shirts for 9 to 5,244701,1283902,19.06
Take a selfie like Kriti Sanon,12828,67286,19.06
Straight from the runway! Check this out!,157339,827552,19.01
Bebo nails the all-white looks,13107,68985,19
Denims in Black & Grey upto 65% off,791,4169,18.97
You can never go wrong with black tees,243300,1283333,18.96
8 Trends For The Summer,24494,129434,18.92
Seasons hottest Kurtas upto 75% off,132178,699257,18.9
YOU. The first thing we think of every morning ❤,465,2460,18.9
Easy to style bottomwear,32340,171183,18.89
The best is yet to come!,432,2288,18.88
Of Checks & Stripes! Shirts under 799 | Free Shipping,195670,1038480,18.84
Check shirts for everyday | free shipping,214295,1139154,18.81
It's Time To Get Fit,55369,294920,18.77
Checked Shirts You Must Own!,16422,87576,18.75
"Hi{user_first_name}, Gorgeous Anarkali Kurtas To Twirl In",228252,1217155,18.75
Full sleeve tees you can wear all year long,125299,669442,18.72
Min 40% - 60% off on EVERYTHING | Free Shipping,236625,1266288,18.69
Kurtas & sets for summer upto 75% off | Free Shipping,10211,54640,18.69
For A Casual Day Out! Shop Now❣️,63743,341423,18.67
Stylish kurta dresses for day & night!,208501,1116876,18.67
Wow Wednesday: Light wear sarees from Kota,208036,1115754,18.65
Shirts in black & white for everyday,439141,2356655,18.63
3 Dresses To Romanticize This Monsoon,57036,306164,18.63
"Ladies, treat yourself: kurtas under 499! Shop Now",182062,977571,18.62
Life's too short! Do what you love❤,412,2214,18.61
"It's Madness! Buy 1 Get 2 Free, Price store and what not? Explore",374785,2021873,18.54
Help your friends discover great Style,405,2187,18.52
"Hi{user_first_name}, 4 ways to style your blue Kurta this summer",188269,1016564,18.52
Tuesday Checklist: Share the love!,464,2505,18.52
1 White Shirt! 3 Ways To Style!,112624,608511,18.51
Style hard so you can shop harder!,480,2600,18.46
"{user_first_name}, Our bestselling tees upto 60% off",33380,180903,18.45
Best Selling Kurtas upto 80% off,180389,977486,18.45
Dresses Starting 699! Just Add To Cart!,1249,6785,18.41
Switch it up with stylish sleeves!,55977,304239,18.4
Bestselling casual shirts for summer,124274,675747,18.39
Kurtas to wear everyday,141966,771883,18.39
.....is cheaper than Therapy!!!!,927,5044,18.38
"{user_first_name}, Beautiful Embroidered Sarees Now On Budget!",204137,1110732,18.38
Style the Reel & Real life Jodi!,397,2162,18.36
Dress To Impress! Shop Formal Wear,151871,827339,18.36
Summer tees Buy 2 for 799 | Free shipping,152189,829471,18.35
The Ultimate Weekend Bash! Come Join!,37717,205630,18.34
Upto 81% Off On The Prettiest Dresses!!,12423,67798,18.32
Summer Tees - Buy 2 for 799 | Free Shipping,221838,1210951,18.32
Min 50% off on everything your wardrobe wants,242141,1322164,18.31
Dress up your day under 899,34410,188049,18.3
Casual shirts in SO. MANY. COLOURS.,53027,289718,18.3
Stylish Kurta dresses for that Monsoon date,197306,1078249,18.3
Bottomwear essentials for a sharp look!,221244,1209478,18.29
In The Blush Of Things 🌸 Shop Now,65875,360353,18.28
Chic Block Print Kurtas,9687,52983,18.28
Last & Final Call!!!,748,4094,18.27
"Hi{user_first_name}, Trending Block Print Kurtas from Jaipur",220752,1207955,18.27
"{user_first_name}, Min 60% off on bestselling kurtas!",16692,91384,18.27
"Hi{user_first_name}, Looks sharp in Formal shirts",10022,54868,18.27
"Ladies, treat yourself: kurtas under 999! Shop Now",4813,26374,18.25
The prices just dropped on 900+ shirts | Free Shipping,207788,1139384,18.24
Millions of people are waiting for your STYLE GYAN!!!,12680,69644,18.21
Style Inspiration: Deepika or Janhavi?,5451,29936,18.21
Full sleeve tees for a wardrobe upgrade,185653,1020341,18.2
"Hi{user_first_name}, Best selling Kurtas Under 499! Check'em out",233109,1280564,18.2
Kurtas every stylish woman owns | free shipping,172893,954215,18.12
"Hi{user_first_name}, 150+ Kurtas & sets for summer | Free Shipping",223632,1234723,18.11
1000+ T-Shirts Under 449!,102187,564700,18.1
Your style is Limited Edition,922,5098,18.09
Bigger than ever😲,420,2322,18.09
It's all Black & White! Shop casual shirts | Free Shipping,223638,1238360,18.06
Casual Shirts for summer by Flyrs club! Flat 549,166310,921221,18.05
"{user_first_name}, Classic straight kurtas handpicked for you",179953,997089,18.05
Everything under 499: LimeRoad's Flea Market,104291,578020,18.04
200+ Bestselling sarees,135110,749436,18.03
Sharing is good and it doesn''t take time,911,5054,18.03
"{user_first_name}, Perfectly styled Kurtas with Palazzos! Shop Now",200281,1112581,18
Under 499: Shirts You Must Own!,150285,835391,17.99
"{user_first_name}, Sneakers while you wait for your order!",39341,218686,17.99
Summer kurtas at flat 399,103886,578669,17.95
Kurtas & sets for summer under 999 | Free Shipping,194663,1084741,17.95
Min 40% - 60% off on just about everything | Free Shipping,220021,1227477,17.92
Bordered sarees for every occassion! Upto 80% OFF,13752,76805,17.91
We make a life by what we SHARE,631,3524,17.91
Wake up Beauty!!!,364,2034,17.9
The Big End of Season Sale | Free Shipping,186557,1044467,17.86
Launching 109F! Shop New,53417,299011,17.86
"Hi{user_first_name}, What your zodiac says for July 2018 💕",217774,1221924,17.82
On trend kurtas to wear all summer,127331,714414,17.82
"Hi{user_first_name}, Offers as hot as you are | Free shipping",185159,1040698,17.79
Get Classic With Solid Kurta Sets,185123,1040604,17.79
Sarees that are flying off our shelves,177098,995935,17.78
Best Denim Styles You Will See Today!,198252,1115547,17.77
You've been missing in action! Come back!,356,2005,17.76
Cotton Kurtas to wear all season!,212776,1198718,17.75
The Coolest July Shop! Everything Under 499,41722,235061,17.75
Pretty Maxi Dresses For The Summer,64817,365553,17.73
Casual Trousers for work & play,353124,1991968,17.73
The Hottest Exclusively On LimeRoad!,30219,170518,17.72
"Hi{user_first_name}, Cool New Tops & Dresses Handpicked For You!",63941,360927,17.72
Playful Playsuits! Shop Now,40386,228048,17.71
Exclusive brands only on limeroad!,106761,603619,17.69
"Hi{user_first_name}, Best selling Kurtas Starting 999! Check'em out",14832,83833,17.69
Bestselling Denims: 40-80% off + Free shipping,193389,1093540,17.68
Sharing today keeps the stress away!,814,4612,17.65
Are you a fan of the 90's Bollywood films?,409,2319,17.64
Summer Ready Bright And Sunny Kurtas,46116,261876,17.61
Four More Shots...oops Looks Please!!!!!,12242,69506,17.61
"Raat gayi, baat gayi?",394,2240,17.59
Maxi Dresses 😍 under 899!,29953,170396,17.58
"Hi{user_first_name}, Dress up for work | Shop shirts & trousers",190636,1085263,17.57
Kurtas for day and night! All under 999,7709,43878,17.57
Summer Tees - Buy 2 for 799,315064,1794177,17.56
Hot Trend Alert: Crayola Brights!,50850,289503,17.56
Festive trends from Rajasthan,132620,755171,17.56
All Things Grey!,159463,909030,17.54
Diljit Dosanjh CRUSHING OVER Kylie Jenner!!!,11995,68433,17.53
Breezy cotton kurtas perfect for you,6957,39691,17.53
order_related,4169194,23810969,17.51
"Hi {user_first_name}, T-shirts is set of 2! Start shopping",162085,926943,17.49
Perfectly matched Kurta sets for you!,10694,61255,17.46
"It's raining credits! Come, grab!",802,4594,17.46
You shop when you share!,439,2517,17.44
Because Sharing is Caring,862,4944,17.44
Your chance to pretty! shop collection 🐇,58983,338224,17.44
Monday's best handpicked styles,216106,1241027,17.41
"{user_first_name}, Must have essentials for every wardrobe! Shop now",213109,1224754,17.4
Last and final call📣,2537,14592,17.39
Pull off this winter look in style.,22155,127551,17.37
Here's your way to the microwave,717,4131,17.36
Shop at Minimum! Best Picks,62109,358281,17.34
You are capable of more than you know,3014,17395,17.33
End Of Season Sale! Everything At Its best!,49659,286590,17.33
"{user_first_name}, Chic kurtas under 499 | Free Shipping",180577,1041995,17.33
"Hi{user_first_name}, Upto 70% off on stylish kurtas | Free Shipping",14189,81903,17.32
Serious Friday Feels Girls! 💁,35556,205428,17.31
Easy to style bottomwear + Free shipping,223039,1288903,17.3
Shirts for work & beyond in checks & stripes,150074,867491,17.3
Summer tees for a wardrobe upgrade,7690,44511,17.28
We are so sorry for the error!,8333,48213,17.28
"{user_first_name}, On Trend Kurtas: Buy 3 For 999 Only!",185389,1075457,17.24
"Buy 1 Get 2 FREE, price store or 80% Off | Free shipping",8552,49609,17.24
"{user_first_name}, Min. 50% Off on your favourite styles | Free shipping",211291,1226337,17.23
Hooded t-shirts starting 499!,6349,36838,17.23
The simplest things like Sharing can bring you great joy,564,3273,17.23
Camouflage is the print of the season,182621,1060834,17.21
All new Solid shirts! Upto 60% off,7535,43818,17.2
"""HALF WE PAY , HALF YOU PAY""",221281,1286796,17.2
All things blue!,150175,873245,17.2
Your potential is endless,6143,35740,17.19
"{user_first_name}, Min 60% off on best selling kurtas!",154691,900254,17.18
This. Just. In. Shop New & Trending!,44035,256483,17.17
140+ Dresses For Date Night,7618,44387,17.16
Summer tees in a bunch! Combos under 699,129716,756475,17.15
Never go to bed mad......,644,3756,17.15
Get. Set. GOLD💰,479,2795,17.14
A dinner date with your loved ones?,418,2439,17.14
Do you have 2 minutes to quickly share a look?,383,2234,17.14
"{user_first_name}, You're Going To Love This.",62654,365585,17.14
Gorgeous Anarkali Kurtas To Twirl In!,6241,36426,17.13
#Budgetbuys: t-shirts,50413,294242,17.13
The Coolest July Shop! Everything You Need,4447,25975,17.12
Min. 500 0ff on everything! Start shopping | Free Shipping,185654,1085907,17.1
"Wear It ""Everywhere"" Dresses | Free Shipping",1446,8460,17.09
The wedding season is in full swing! Are you?,4412,25814,17.09
Spread some love......NOW!!!,681,3985,17.09
For rain & shine: Shop comfy Cotton Kurtas,5383,31525,17.08
The coolest style for hot weather,231852,1357608,17.08
"You share, we make you shop - Deal!",425,2489,17.08
Style the cute-mad Jodi: Ranveer & Sara,359,2102,17.08
Good style can make the world go round,816,4778,17.08
Buy these prints you will love,177943,1041628,17.08
Handpicked styles for this Friday + Free shipping,145648,852516,17.08
CRIMSOUNE CLUB Upto 50% off,5235,30668,17.07
"{user_first_name}, Palazzos while you wait for your order!",21729,127370,17.06
Festive Block Prints on a budget,177064,1038895,17.04
Shop black & grey denims! upto 80% off!,90758,533440,17.01
Easy Maxi Dresses,174846,1028052,17.01
Tell Your Sisters: Upto 81% Off On Dresses | Free Shipping,57065,335675,17
Casual shirts for everyday,161395,950290,16.98
Because we trust your STYLE,739,4354,16.97
👖 Bottomwear to save the day!,189894,1119094,16.97
You're lucky when you're ready! Are you?,4834,28520,16.95
10 shirt & tie combos,33354,196875,16.94
Your style is Limited Edition,11660,68821,16.94
Georgette sarees that are instant classics,202961,1198547,16.93
On trend kurtas to wear all summer! Shop Now,211855,1252990,16.91
"{user_first_name}, Peter England Upto 60% off",3194,18915,16.89
"All things blue! Shop tees, shirts, sneakers & more",146467,867492,16.88
You get what you work and wish for!!!,10364,61400,16.88
6 Types Of T-Shirts For Every Season!,160873,953464,16.87
Handpicked Boat neck Kurtas for you,120538,714338,16.87
"Hi{user_first_name}, Hottest selling kurtas to steal!",42808,253850,16.86
